{
  "id": "boots",
  "title": "BOOTS",
  "original_title": null,
  "category": "series",
  "subcategories": [],
  "format": "series",
  "status": "cancelled",
  "genres": [
    "drama"
  ],
  "countries": [
    "US"
  ],
  "studios": [],
  "directors": [],
  "first_release_year": 2026,
  "external_ids": {
    "imdb": null,
    "tmdb": null,
    "anilist": null,
    "myanimelist": null
  },
  "poster": null,
  "notes": "Dado demonstrativo para serie cancelada."
}
