{
  "id": "your-name",
  "title": "Your Name",
  "original_title": "Kimi no Na wa.",
  "category": "movie",
  "subcategories": [],
  "format": "movie",
  "status": "ended",
  "genres": [
    "romance",
    "fantasy"
  ],
  "countries": [
    "JP"
  ],
  "studios": [],
  "directors": [
    "Makoto Shinkai"
  ],
  "first_release_year": 2016,
  "external_ids": {
    "imdb": null,
    "tmdb": null,
    "anilist": null,
    "myanimelist": null
  },
  "poster": null,
  "notes": "Dado demonstrativo para filme."
}
