{
  "id": "spy-family",
  "title": "Spy Family",
  "original_title": null,
  "category": "anime",
  "subcategories": [],
  "format": "series",
  "status": "ongoing",
  "genres": [
    "action",
    "comedy"
  ],
  "countries": [
    "JP"
  ],
  "studios": [],
  "directors": [],
  "first_release_year": 2022,
  "external_ids": {
    "imdb": null,
    "tmdb": null,
    "anilist": null,
    "myanimelist": null
  },
  "poster": null,
  "notes": "Dado demonstrativo para anime em andamento."
}
